{
  "$schema": "http://json-schema.org/draft-07/schema#",
  "title": "ScriptOutput",
  "description": "Output from the Scriptwriter Agent: a beat-split video script ready for the Producer to render.",
  "type": "object",
  "required": [
    "hook",
    "body",
    "cta",
    "estimated_duration",
    "format",
    "claims_used",
    "suggested_visual_beats"
  ],
  "properties": {
    "hook": {
      "type": "string",
      "description": "Opening hook narration text."
    },
    "body": {
      "type": "string",
      "description": "Full body narration text (may duplicate suggested_visual_beats narration for reference)."
    },
    "cta": {
      "type": "string",
      "description": "Call-to-action narration text."
    },
    "estimated_duration": {
      "type": "number",
      "minimum": 0,
      "description": "Estimated total video duration in seconds."
    },
    "format": {
      "type": "string",
      "description": "Video format type (e.g. 'stat-heavy explainer', 'mechanism-diagram explainer')."
    },
    "claims_used": {
      "type": "array",
      "items": {
        "type": "string"
      },
      "description": "Claims from ResearchOutput that are used in the script."
    },
    "claims_not_used": {
      "type": "array",
      "items": {
        "type": "string"
      },
      "description": "Claims from ResearchOutput that were excluded from the script."
    },
    "suggested_visual_beats": {
      "type": "array",
      "items": {
        "type": "object",
        "required": ["name", "narration_text"],
        "properties": {
          "name": {
            "type": "string",
            "description": "Unique name/identifier for this beat (e.g. 'beat_01_overview')."
          },
          "narration_text": {
            "type": "string",
            "description": "The narration text for this specific beat (used to generate per-beat audio)."
          },
          "beat_type": {
            "type": "string",
            "enum": ["stat_reveal", "diagram", "kinetic_text", "image", "custom"],
            "description": "Type of visual component to use for this beat."
          },
          "image_url": {
            "type": "string",
            "format": "uri",
            "description": "Optional image URL for beats that use KenBurnsImage."
          },
          "asset_subject": {"type": "string"},
          "asset_type": {"type": "string", "enum": ["article_image", "person", "logo", "product", "screenshot", "location", "chart", "diagram", "map", "table", "data_viz", "video"]},
          "image_treatment": {"type": "string", "enum": ["editorial_frame", "portrait_cutout", "product_focus", "logo_mark", "screenshot_focus", "location_wide"]},
          "asset_source_url": {"type": "string", "format": "uri"},
          "asset_credit": {"type": "string"}
          ,"visual_style": {"type": "string", "enum": ["editorial", "image_led", "stat_led", "diagram", "timeline", "quiet"]}
          }
        },
        "description": "Ordered list of visual beats. Each beat gets its own narration audio — this is load-bearing for Phase 1's per-beat audio generation."
      }
  },
  "additionalProperties": false
}
